<?xml version="1.0" encoding="utf-8" ?>
<formatierung xmlns="http://www.hg-online.de/terminformat" xmlns:xsi="http://www.w3.org/2001/XMLSchema-instance" 
              xsi:schemaLocation="http://www.hg-online.de/terminformat terminformat.xsd">
  <formate>
    <format>
      <zeilen>
        <zeile>
          <spalten>
            <spalte width="40">
              <felder>
                <feld feld="VonBis" style="Vorstellung Zeile 1"/>
                <feld feld="Produktionskurzbezeichnung" textbefore=" " style="Vorstellung Zeile 1"/>
              </felder>
            </spalte>
            <spalte width="40">
              <felder>
                <feld feld="TagesplanBemerkung" style="Vorstellung Zeile 2"/>
                <!--Funktion "Direktionsdienst"-->
                <feld feld="SzenDienst" textbefore="D.: " besetzungsfunktionIds="12503"/>
              </felder>
            </spalte>
            <spalte width="40">
              <felder>
                <feld feld="Platzhalter" scriptplatzhalter="wolletest"/>

              </felder>
            </spalte>
          </spalten>
        </zeile>
      </zeilen>
    </format>
  </formate>
</formatierung>